{"schema_version":1,"region_id":"morro-bay","note":"Public launch ramps, hoists and beach launches a trip can start from, one list per region. Positions are the facility positions listed by the source, good for choosing a launch and estimating run distance to a spot; they are never navigation waypoints, and `departure` is an approximate open-water position outside the harbor used only for distance estimates.","sources":{"dbw":{"name":"California State Parks, Division of Boating and Waterways: Boating Facilities database","url":"https://dbw.parks.ca.gov/BoatingFacilities/","retrieved":"2026-09-30","note":"State facility records (name, address, listed position, operator, trailer parking, floats, services). Confirm hours, fees and conditions with the operator before a trip."}},"launch_points":[{"id":"morro-bay-public-launch","region":"morro-bay","name":"Morro Bay Public Launch Facility","kind":"ramp","operator":"City of Morro Bay","address":"Embarcadero at Tidelands Park, Morro Bay, CA 93442","latitude":35.357693,"longitude":-120.850164,"departure":{"latitude":35.3667,"longitude":-120.868,"note":"Outside the Morro Bay entrance; recheck the actual entrance and bar at departure and return."},"forecast_point":"central","trailer_parking":42,"boarding_floats":2,"services":["washdown"],"phone":"(805) 772-6254","url":"https://www.morrobayca.gov/144/Harbor","note":null,"source":"dbw","source_id":"1465"},{"id":"olde-port-beach","region":"morro-bay","name":"Olde Port Beach","kind":"beach","operator":null,"address":"6520 Avila Beach Dr, Avila Beach, CA 93424","latitude":35.178455,"longitude":-120.748499,"departure":{"latitude":35.16,"longitude":-120.745,"note":"Open water south-east of the Port San Luis breakwater."},"forecast_point":"avila","trailer_parking":null,"boarding_floats":null,"services":[],"phone":null,"url":null,"note":"Beach launch for small trailered boats; conditions and access change, so check with the harbor district first.","source":"dbw","source_id":"49"},{"id":"port-san-luis-launch","region":"morro-bay","name":"Port San Luis Boat Launch Facility","kind":"ramp","operator":"Port San Luis Harbor District","address":"3950 Avila Beach Dr, Avila Beach, CA 93424","latitude":35.171782,"longitude":-120.755679,"departure":{"latitude":35.16,"longitude":-120.745,"note":"Open water south-east of the Port San Luis breakwater."},"forecast_point":"avila","trailer_parking":35,"boarding_floats":2,"services":["washdown","fuel","fish-cleaning","valet-launch","haul-out"],"phone":"(805) 595-5400","url":"https://www.portsanluis.com","note":"The harbor district also hoist-launches from Harford Pier; ask it for weight and size limits.","source":"dbw","source_id":"1082"}]}
